[
  {
    "id": "legacy.sansu.g2.math-2-3.1d5ef99540a2",
    "type": "text-input",
    "subject": "sansu",
    "grade": 2,
    "unit": "sansu.g2.legacy-math-2-3",
    "tags": [
      "source:legacy-autonomy-game",
      "legacy-node:math_2_3",
      "reviewed:structural-v1"
    ],
    "payload": {
      "prompt": "つぎのけいさんを、しましょう。",
      "answers": [
        "80"
      ]
    },
    "explanation": "一のくらいの 7 から 7 をひいて、こたえは、80 になる。"
  },
  {
    "id": "legacy.sansu.g2.math-2-3.1f5712aac717",
    "type": "text-input",
    "subject": "sansu",
    "grade": 2,
    "unit": "sansu.g2.legacy-math-2-3",
    "tags": [
      "source:legacy-autonomy-game",
      "legacy-node:math_2_3",
      "reviewed:structural-v1"
    ],
    "payload": {
      "prompt": "つぎのけいさんを、しましょう。",
      "answers": [
        "11"
      ]
    },
    "explanation": "一のくらいの 4 から 3 をひいて、こたえは、11 になる。"
  },
  {
    "id": "legacy.sansu.g2.math-2-3.4524a800d63e",
    "type": "text-input",
    "subject": "sansu",
    "grade": 2,
    "unit": "sansu.g2.legacy-math-2-3",
    "tags": [
      "source:legacy-autonomy-game",
      "legacy-node:math_2_3",
      "reviewed:structural-v1"
    ],
    "payload": {
      "prompt": "つぎのけいさんを、しましょう。",
      "answers": [
        "52"
      ]
    },
    "explanation": "十のくらいの 9 から 4 をひいて、こたえは、52 になる。"
  },
  {
    "id": "legacy.sansu.g2.math-2-3.49062b5dd3af",
    "type": "text-input",
    "subject": "sansu",
    "grade": 2,
    "unit": "sansu.g2.legacy-math-2-3",
    "tags": [
      "source:legacy-autonomy-game",
      "legacy-node:math_2_3",
      "reviewed:structural-v1"
    ],
    "payload": {
      "prompt": "つぎのけいさんを、しましょう。",
      "answers": [
        "33"
      ]
    },
    "explanation": "一のくらいの 0 から 7 はひけないので、40 から 10 をくずす（くりさがり）。 10-7=3 になるので、もとの 30 とあわせて、33 になる。"
  },
  {
    "id": "legacy.sansu.g2.math-2-3.4d247235dc89",
    "type": "text-input",
    "subject": "sansu",
    "grade": 2,
    "unit": "sansu.g2.legacy-math-2-3",
    "tags": [
      "source:legacy-autonomy-game",
      "legacy-node:math_2_3",
      "reviewed:structural-v1"
    ],
    "payload": {
      "prompt": "つぎのけいさんを、しましょう。",
      "answers": [
        "71"
      ]
    },
    "explanation": "一のくらいの 8 から 7 をひいて、こたえは71 になる。"
  },
  {
    "id": "legacy.sansu.g2.math-2-3.57c1ba67d84b",
    "type": "text-input",
    "subject": "sansu",
    "grade": 2,
    "unit": "sansu.g2.legacy-math-2-3",
    "tags": [
      "source:legacy-autonomy-game",
      "legacy-node:math_2_3",
      "reviewed:structural-v1"
    ],
    "payload": {
      "prompt": "つぎのけいさんを、しましょう。",
      "answers": [
        "16"
      ]
    },
    "explanation": "一のくらいの 1 から 5 はひけないので、20 から 10 をくずす（くりさがり）。11-5=6 になるので、もとの 10 とあわせて、16 になる。"
  },
  {
    "id": "legacy.sansu.g2.math-2-3.a7e70a1131d9",
    "type": "text-input",
    "subject": "sansu",
    "grade": 2,
    "unit": "sansu.g2.legacy-math-2-3",
    "tags": [
      "source:legacy-autonomy-game",
      "legacy-node:math_2_3",
      "reviewed:structural-v1"
    ],
    "payload": {
      "prompt": "つぎのけいさんを、しましょう。",
      "answers": [
        "38"
      ]
    },
    "explanation": "一のくらいの 2 から 4 はひけないので、40 から 10 をくずす（くりさがり）。 12-4=8 になるので、もとの 30 とあわせて、38 になる。"
  },
  {
    "id": "legacy.sansu.g2.math-2-3.ca2148f91328",
    "type": "text-input",
    "subject": "sansu",
    "grade": 2,
    "unit": "sansu.g2.legacy-math-2-3",
    "tags": [
      "source:legacy-autonomy-game",
      "legacy-node:math_2_3",
      "reviewed:structural-v1"
    ],
    "payload": {
      "prompt": "つぎのけいさんを、しましょう。",
      "answers": [
        "27"
      ]
    },
    "explanation": "一のくらいの 6 から 9 はひけないので、30 から 10 をくずす（くりさがり）。 16-9=7 になるので、もとの 20 とあわせて、27 になる。"
  },
  {
    "id": "legacy.sansu.g2.math-2-3.e931d73a285e",
    "type": "text-input",
    "subject": "sansu",
    "grade": 2,
    "unit": "sansu.g2.legacy-math-2-3",
    "tags": [
      "source:legacy-autonomy-game",
      "legacy-node:math_2_3",
      "reviewed:structural-v1"
    ],
    "payload": {
      "prompt": "つぎのけいさんを、しましょう。",
      "answers": [
        "23"
      ]
    },
    "explanation": "十のくらいの 3 から 1 をひいて、こたえは、23 になる。"
  },
  {
    "id": "legacy.sansu.g2.math-2-3.e97401a008f5",
    "type": "text-input",
    "subject": "sansu",
    "grade": 2,
    "unit": "sansu.g2.legacy-math-2-3",
    "tags": [
      "source:legacy-autonomy-game",
      "legacy-node:math_2_3",
      "reviewed:structural-v1"
    ],
    "payload": {
      "prompt": "つぎのけいさんを、しましょう。",
      "answers": [
        "89"
      ]
    },
    "explanation": "一のくらいの 2 から 3 はひけないので、90 から 10 をくずす（くりさがり）。 12-3=9 になるので、もとの 80 とあわせて、89 になる。"
  },
  {
    "id": "legacy.sansu.g2.math-2-3.ed39c94cd617",
    "type": "text-input",
    "subject": "sansu",
    "grade": 2,
    "unit": "sansu.g2.legacy-math-2-3",
    "tags": [
      "source:legacy-autonomy-game",
      "legacy-node:math_2_3",
      "reviewed:structural-v1"
    ],
    "payload": {
      "prompt": "つぎのけいさんを、しましょう。",
      "answers": [
        "68"
      ]
    },
    "explanation": "一のくらいの 5 から 7 はひけないので、70 から 10 をくずす（くりさがり）。 15-7=8 になるので、もとの 60 とあわせて、68 になる。"
  }
]
