[
  {
    "id": "legacy.sansu.g2.math-2-10.00534c612a9e",
    "type": "text-input",
    "subject": "sansu",
    "grade": 2,
    "unit": "sansu.g2.legacy-math-2-10",
    "tags": [
      "source:legacy-autonomy-game",
      "legacy-node:math_2_10",
      "reviewed:structural-v1"
    ],
    "payload": {
      "prompt": "つぎのけいさんを、しましょう。",
      "answers": [
        "63"
      ]
    },
    "explanation": "\\require{cancel} 1 4 5 - 8 2 6 3"
  },
  {
    "id": "legacy.sansu.g2.math-2-10.03e8f6dd1134",
    "type": "text-input",
    "subject": "sansu",
    "grade": 2,
    "unit": "sansu.g2.legacy-math-2-10",
    "tags": [
      "source:legacy-autonomy-game",
      "legacy-node:math_2_10",
      "reviewed:structural-v1"
    ],
    "payload": {
      "prompt": "つぎのけいさんを、しましょう。",
      "answers": [
        "65"
      ]
    },
    "explanation": "\\require{cancel} 3 1 1 \\bcancel{4} 3 - 7 8 6 5"
  },
  {
    "id": "legacy.sansu.g2.math-2-10.063519bfc12e",
    "type": "text-input",
    "subject": "sansu",
    "grade": 2,
    "unit": "sansu.g2.legacy-math-2-10",
    "tags": [
      "source:legacy-autonomy-game",
      "legacy-node:math_2_10",
      "reviewed:structural-v1"
    ],
    "payload": {
      "prompt": "つぎのけいさんを、しましょう。",
      "answers": [
        "4"
      ]
    },
    "explanation": "\\require{cancel} 9 1 \\bcancel{1} \\bcancel{0} 2 - 9 8 4"
  },
  {
    "id": "legacy.sansu.g2.math-2-10.1a667e39ecb9",
    "type": "text-input",
    "subject": "sansu",
    "grade": 2,
    "unit": "sansu.g2.legacy-math-2-10",
    "tags": [
      "source:legacy-autonomy-game",
      "legacy-node:math_2_10",
      "reviewed:structural-v1"
    ],
    "payload": {
      "prompt": "つぎのけいさんを、しましょう。",
      "answers": [
        "81"
      ]
    },
    "explanation": "\\require{cancel} 1 1 1 - 3 0 8 1"
  },
  {
    "id": "legacy.sansu.g2.math-2-10.44c95fa1cf03",
    "type": "text-input",
    "subject": "sansu",
    "grade": 2,
    "unit": "sansu.g2.legacy-math-2-10",
    "tags": [
      "source:legacy-autonomy-game",
      "legacy-node:math_2_10",
      "reviewed:structural-v1"
    ],
    "payload": {
      "prompt": "つぎのけいさんを、しましょう。",
      "answers": [
        "88"
      ]
    },
    "explanation": "\\require{cancel} 1 1 1 \\bcancel{2} 5 - 3 7 8 8"
  },
  {
    "id": "legacy.sansu.g2.math-2-10.4aee7f46eb68",
    "type": "text-input",
    "subject": "sansu",
    "grade": 2,
    "unit": "sansu.g2.legacy-math-2-10",
    "tags": [
      "source:legacy-autonomy-game",
      "legacy-node:math_2_10",
      "reviewed:structural-v1"
    ],
    "payload": {
      "prompt": "つぎのけいさんを、しましょう。",
      "answers": [
        "58"
      ]
    },
    "explanation": "\\require{cancel} 7 1 \\bcancel{8} 3 - 2 5 5 8"
  },
  {
    "id": "legacy.sansu.g2.math-2-10.518e69bf13e4",
    "type": "text-input",
    "subject": "sansu",
    "grade": 2,
    "unit": "sansu.g2.legacy-math-2-10",
    "tags": [
      "source:legacy-autonomy-game",
      "legacy-node:math_2_10",
      "reviewed:structural-v1"
    ],
    "payload": {
      "prompt": "つぎのけいさんを、しましょう。",
      "answers": [
        "67"
      ]
    },
    "explanation": "\\require{cancel} 2 1 1 \\bcancel{3} 2 - 6 5 6 7"
  },
  {
    "id": "legacy.sansu.g2.math-2-10.5a52ba10f7f6",
    "type": "text-input",
    "subject": "sansu",
    "grade": 2,
    "unit": "sansu.g2.legacy-math-2-10",
    "tags": [
      "source:legacy-autonomy-game",
      "legacy-node:math_2_10",
      "reviewed:structural-v1"
    ],
    "payload": {
      "prompt": "つぎのけいさんを、しましょう。",
      "answers": [
        "91"
      ]
    },
    "explanation": "\\require{cancel} 1 2 6 - 3 5 9 1"
  },
  {
    "id": "legacy.sansu.g2.math-2-10.61e0bcf8fdb0",
    "type": "text-input",
    "subject": "sansu",
    "grade": 2,
    "unit": "sansu.g2.legacy-math-2-10",
    "tags": [
      "source:legacy-autonomy-game",
      "legacy-node:math_2_10",
      "reviewed:structural-v1"
    ],
    "payload": {
      "prompt": "つぎのけいさんを、しましょう。",
      "answers": [
        "69"
      ]
    },
    "explanation": "\\require{cancel} 5 1 1 \\bcancel{6} 5 - 9 6 6 9"
  },
  {
    "id": "legacy.sansu.g2.math-2-10.6db8da29fcd7",
    "type": "text-input",
    "subject": "sansu",
    "grade": 2,
    "unit": "sansu.g2.legacy-math-2-10",
    "tags": [
      "source:legacy-autonomy-game",
      "legacy-node:math_2_10",
      "reviewed:structural-v1"
    ],
    "payload": {
      "prompt": "つぎのけいさんを、しましょう。",
      "answers": [
        "97"
      ]
    },
    "explanation": "\\require{cancel} 3 1 1 \\bcancel{4} 4 - 4 7 9 7"
  },
  {
    "id": "legacy.sansu.g2.math-2-10.788180450b8e",
    "type": "text-input",
    "subject": "sansu",
    "grade": 2,
    "unit": "sansu.g2.legacy-math-2-10",
    "tags": [
      "source:legacy-autonomy-game",
      "legacy-node:math_2_10",
      "reviewed:structural-v1"
    ],
    "payload": {
      "prompt": "つぎのけいさんを、しましょう。",
      "answers": [
        "96"
      ]
    },
    "explanation": "\\require{cancel} 1 7 9 - 8 3 9 6"
  },
  {
    "id": "legacy.sansu.g2.math-2-10.89fb627e0d68",
    "type": "text-input",
    "subject": "sansu",
    "grade": 2,
    "unit": "sansu.g2.legacy-math-2-10",
    "tags": [
      "source:legacy-autonomy-game",
      "legacy-node:math_2_10",
      "reviewed:structural-v1"
    ],
    "payload": {
      "prompt": "つぎのけいさんを、しましょう。",
      "answers": [
        "83"
      ]
    },
    "explanation": "\\require{cancel} 6 1 1 \\bcancel{7} 2 - 8 9 8 3"
  },
  {
    "id": "legacy.sansu.g2.math-2-10.9ae7b072cce2",
    "type": "text-input",
    "subject": "sansu",
    "grade": 2,
    "unit": "sansu.g2.legacy-math-2-10",
    "tags": [
      "source:legacy-autonomy-game",
      "legacy-node:math_2_10",
      "reviewed:structural-v1"
    ],
    "payload": {
      "prompt": "つぎのけいさんを、しましょう。",
      "answers": [
        "57"
      ]
    },
    "explanation": "\\require{cancel} 9 1 \\bcancel{1} \\bcancel{0} 3 - 4 6 5 7"
  },
  {
    "id": "legacy.sansu.g2.math-2-10.c2be718758e6",
    "type": "text-input",
    "subject": "sansu",
    "grade": 2,
    "unit": "sansu.g2.legacy-math-2-10",
    "tags": [
      "source:legacy-autonomy-game",
      "legacy-node:math_2_10",
      "reviewed:structural-v1"
    ],
    "payload": {
      "prompt": "つぎのけいさんを、しましょう。",
      "answers": [
        "61"
      ]
    },
    "explanation": "\\require{cancel} 1 0 7 - 4 6 6 1"
  },
  {
    "id": "legacy.sansu.g2.math-2-10.c464324d6859",
    "type": "text-input",
    "subject": "sansu",
    "grade": 2,
    "unit": "sansu.g2.legacy-math-2-10",
    "tags": [
      "source:legacy-autonomy-game",
      "legacy-node:math_2_10",
      "reviewed:structural-v1"
    ],
    "payload": {
      "prompt": "つぎのけいさんを、しましょう。",
      "answers": [
        "78"
      ]
    },
    "explanation": "\\require{cancel} 1 1 1 \\bcancel{2} 6 - 4 8 7 8"
  },
  {
    "id": "legacy.sansu.g2.math-2-10.d776b43e1d65",
    "type": "text-input",
    "subject": "sansu",
    "grade": 2,
    "unit": "sansu.g2.legacy-math-2-10",
    "tags": [
      "source:legacy-autonomy-game",
      "legacy-node:math_2_10",
      "reviewed:structural-v1"
    ],
    "payload": {
      "prompt": "つぎのけいさんを、しましょう。",
      "answers": [
        "87"
      ]
    },
    "explanation": "\\require{cancel} 9 1 \\bcancel{1} \\bcancel{0} 5 - 1 8 8 7"
  },
  {
    "id": "legacy.sansu.g2.math-2-10.dcf272069d80",
    "type": "text-input",
    "subject": "sansu",
    "grade": 2,
    "unit": "sansu.g2.legacy-math-2-10",
    "tags": [
      "source:legacy-autonomy-game",
      "legacy-node:math_2_10",
      "reviewed:structural-v1"
    ],
    "payload": {
      "prompt": "つぎのけいさんを、しましょう。",
      "answers": [
        "48"
      ]
    },
    "explanation": "\\require{cancel} 9 1 \\bcancel{1} \\bcancel{0} 3 - 5 5 4 8"
  },
  {
    "id": "legacy.sansu.g2.math-2-10.f36d7043804c",
    "type": "text-input",
    "subject": "sansu",
    "grade": 2,
    "unit": "sansu.g2.legacy-math-2-10",
    "tags": [
      "source:legacy-autonomy-game",
      "legacy-node:math_2_10",
      "reviewed:structural-v1"
    ],
    "payload": {
      "prompt": "つぎのけいさんを、しましょう。",
      "answers": [
        "12"
      ]
    },
    "explanation": "\\require{cancel} 0 1 1 \\bcancel{1} 1 - 9 9 1 2"
  }
]
