[
  {
    "id": "legacy.sansu.g1.math-1-4.1cbc2264a1ee",
    "type": "text-input",
    "subject": "sansu",
    "grade": 1,
    "unit": "sansu.g1.legacy-math-1-4",
    "tags": [
      "source:legacy-autonomy-game",
      "legacy-node:math_1_4",
      "reviewed:structural-v1"
    ],
    "payload": {
      "prompt": "つぎのけいさんを、しましょう。",
      "answers": [
        "13"
      ],
      "template": "11 ＋ 2 ＝ {{INPUT}}"
    },
    "explanation": "11 は、10 と 1 にわけられる。この 1 と 2 をあわせて、3。10 と 3 をあわせて、13 になるね。"
  },
  {
    "id": "legacy.sansu.g1.math-1-4.31a736f90b43",
    "type": "text-input",
    "subject": "sansu",
    "grade": 1,
    "unit": "sansu.g1.legacy-math-1-4",
    "tags": [
      "source:legacy-autonomy-game",
      "legacy-node:math_1_4",
      "reviewed:structural-v1"
    ],
    "payload": {
      "prompt": "つぎのけいさんを、しましょう。",
      "answers": [
        "15"
      ],
      "template": "12 ＋ 3 ＝ {{INPUT}}"
    },
    "explanation": "12 は、10 と 2 にわけられる。この 2 と 3 をあわせて、5。10 と 5 をあわせて、15 になるね。"
  },
  {
    "id": "legacy.sansu.g1.math-1-4.6dd4c9af22c3",
    "type": "text-input",
    "subject": "sansu",
    "grade": 1,
    "unit": "sansu.g1.legacy-math-1-4",
    "tags": [
      "source:legacy-autonomy-game",
      "legacy-node:math_1_4",
      "reviewed:structural-v1"
    ],
    "payload": {
      "prompt": "つぎのけいさんを、しましょう。",
      "answers": [
        "14"
      ],
      "template": "19 － 5 ＝ {{INPUT}}"
    },
    "explanation": "19 は、10 と 9 にわけられる。この 9 から 5 をひいて、4。10 と 4 をあわせて、14 になるね。"
  },
  {
    "id": "legacy.sansu.g1.math-1-4.90bf0bce1449",
    "type": "text-input",
    "subject": "sansu",
    "grade": 1,
    "unit": "sansu.g1.legacy-math-1-4",
    "tags": [
      "source:legacy-autonomy-game",
      "legacy-node:math_1_4",
      "reviewed:structural-v1"
    ],
    "payload": {
      "prompt": "○は、いくつあるでしょう。",
      "answers": [
        "17"
      ],
      "template": "{{INPUT}}こ",
      "suffix": "こ",
      "promptImage": "questions/legacy/79d419626583a6d3.png"
    }
  },
  {
    "id": "legacy.sansu.g1.math-1-4.91bda509042f",
    "type": "text-input",
    "subject": "sansu",
    "grade": 1,
    "unit": "sansu.g1.legacy-math-1-4",
    "tags": [
      "source:legacy-autonomy-game",
      "legacy-node:math_1_4",
      "reviewed:structural-v1"
    ],
    "payload": {
      "prompt": "つぎのけいさんを、しましょう。",
      "answers": [
        "11"
      ],
      "template": "18 － 7 ＝ {{INPUT}}"
    },
    "explanation": "18 は、10 と 8 にわけられる。この 8 から 7 をひいて、1。10 と 1 をあわせて、11 になるね。"
  },
  {
    "id": "legacy.sansu.g1.math-1-4.c3f964f63f3a",
    "type": "text-input",
    "subject": "sansu",
    "grade": 1,
    "unit": "sansu.g1.legacy-math-1-4",
    "tags": [
      "source:legacy-autonomy-game",
      "legacy-node:math_1_4",
      "reviewed:structural-v1"
    ],
    "payload": {
      "prompt": "○は、いくつあるでしょう。",
      "answers": [
        "12"
      ],
      "template": "{{INPUT}}こ",
      "suffix": "こ",
      "promptImage": "questions/legacy/81e747592d8a6225.png"
    }
  },
  {
    "id": "legacy.sansu.g1.math-1-4.e2ac63761c6b",
    "type": "text-input",
    "subject": "sansu",
    "grade": 1,
    "unit": "sansu.g1.legacy-math-1-4",
    "tags": [
      "source:legacy-autonomy-game",
      "legacy-node:math_1_4",
      "reviewed:structural-v1"
    ],
    "payload": {
      "prompt": "つぎのけいさんを、しましょう。",
      "answers": [
        "19"
      ],
      "template": "18 ＋ 1 ＝ {{INPUT}}"
    },
    "explanation": "18 は、10 と 8 にわけられる。この 8 と 1 をあわせて、9。10 と 9 をあわせて、19 になるね。"
  },
  {
    "id": "legacy.sansu.g1.math-1-4.fd58036ae425",
    "type": "text-input",
    "subject": "sansu",
    "grade": 1,
    "unit": "sansu.g1.legacy-math-1-4",
    "tags": [
      "source:legacy-autonomy-game",
      "legacy-node:math_1_4",
      "reviewed:structural-v1"
    ],
    "payload": {
      "prompt": "つぎのけいさんを、しましょう。",
      "answers": [
        "18"
      ],
      "template": "15 ＋ 3 ＝ {{INPUT}}"
    },
    "explanation": "15 は、10 と 5 にわけられる。この 5 と 3 をあわせて、8。10 と 8 をあわせて、18 になるね。"
  }
]
